{
  "app": {
    "build": "43",
    "bundleIdentifier": "com.getboolean.eikon.rootless",
    "commit": "9b2b9de",
    "packageKind": "deb",
    "version": "0.2.1"
  },
  "device": {
    "chip": "M2",
    "cpuFamily": "0xda33d83d",
    "modelIdentifier": "iPad14,5"
  },
  "gates": {},
  "generatedAt": "2026-09-28T08:45:29Z",
  "install": {
    "evidence": {
      "bundlePath": "/private/preboot/<hash>/dopamine-<id>/procursus/Applications/Eikon.app",
      "homeDirectory": "/var/mobile/Containers/Data/Application/<uuid>",
      "markers": [
        ".installed_dopamine",
        "basebin"
      ]
    },
    "method": "dopamine"
  },
  "jit": {
    "csDebugged": false,
    "csDebuggedSeen": "never",
    "probe": {
      "detail": "no CS_DEBUGGED",
      "kind": "notRun"
    },
    "reason": "dopamineJITOff",
    "source": "none",
    "txm": {
      "basis": "os below 26",
      "enforced": false,
      "state": "absent"
    },
    "usable": false
  },
  "memory": {
    "availableBytes": 8569796736
  },
  "os": {
    "build": "21A329",
    "name": "iPadOS",
    "version": "17.0"
  },
  "schemaVersion": 1
}
