{
  "app": {
    "build": "51",
    "bundleIdentifier": "com.getboolean.eikon",
    "commit": "0bc7f95",
    "packageKind": "ipa",
    "version": "0.2.3"
  },
  "device": {
    "chip": "M2",
    "cpuFamily": "0xda33d83d",
    "modelIdentifier": "iPad14,5"
  },
  "gates": {},
  "generatedAt": "2026-09-28T10:03:43Z",
  "install": {
    "evidence": {
      "bundlePath": "/private/var/containers/Bundle/Application/<uuid>/Eikon.app",
      "homeDirectory": "/var/mobile/Containers/Data/Application/<uuid>",
      "markers": [
        ".installed_dopamine",
        "container-required"
      ]
    },
    "method": "trollStore"
  },
  "jit": {
    "csDebugged": true,
    "csDebuggedSeen": "afterTrollStoreRequest",
    "probe": {
      "kind": "passed"
    },
    "source": "trollStore",
    "txm": {
      "basis": "os below 26",
      "enforced": false,
      "state": "absent"
    },
    "usable": true
  },
  "memory": {
    "availableBytes": 8568125504
  },
  "notes": "TrollStore install, tap launch, Dopamine app JIT off. JIT came from the automatic enable-jit request.",
  "os": {
    "build": "21A329",
    "name": "iPadOS",
    "version": "17.0"
  },
  "schemaVersion": 1
}
