{
  "app": {
    "build": "27",
    "bundleIdentifier": "com.getboolean.eikon.ANL5UN4557",
    "commit": "b4c7273",
    "packageKind": "ipa",
    "version": "0.1.0"
  },
  "device": {
    "chip": "M2",
    "cpuFamily": "0xda33d83d",
    "modelIdentifier": "iPad14,5"
  },
  "gates": {},
  "generatedAt": "2026-09-28T03:50:49Z",
  "install": {
    "evidence": {
      "bundlePath": "/private/var/containers/Bundle/Application/<uuid>/App.app",
      "homeDirectory": "/var/mobile/Containers/Data/Application/<uuid>",
      "markers": [
        ".installed_dopamine",
        "embedded.mobileprovision"
      ]
    },
    "method": "sideloaded"
  },
  "jit": {
    "csDebugged": true,
    "csDebuggedSeen": "atLaunch",
    "probe": {
      "kind": "passed"
    },
    "source": "preexisting",
    "txm": {
      "basis": "os below 26",
      "enforced": false,
      "state": "absent"
    },
    "usable": true
  },
  "memory": {
    "availableBytes": 8564160640
  },
  "os": {
    "build": "21A329",
    "name": "iPadOS",
    "version": "17.0"
  },
  "schemaVersion": 1
}
