{
  "app": {
    "build": "47",
    "bundleIdentifier": "com.getboolean.eikon",
    "commit": "ae51c38",
    "packageKind": "ipa",
    "version": "0.2.2"
  },
  "device": {
    "chip": "M2",
    "cpuFamily": "0xda33d83d",
    "modelIdentifier": "iPad14,5"
  },
  "gates": {},
  "generatedAt": "2026-09-28T09:51:34Z",
  "install": {
    "evidence": {
      "bundlePath": "/private/var/mobile/Containers/Data/Application/<uuid>/Documents/Applications/com.getboolean.eikon.app",
      "homeDirectory": "/var/mobile/Containers/Data/Application/<uuid>/Documents/Data/Application/<uuid>",
      "markers": [
        ".installed_dopamine"
      ]
    },
    "method": "unknown"
  },
  "jit": {
    "csDebugged": true,
    "csDebuggedSeen": "atLaunch",
    "probe": {
      "kind": "passed"
    },
    "source": "unknown",
    "txm": {
      "basis": "os below 26",
      "enforced": false,
      "state": "absent"
    },
    "usable": true
  },
  "memory": {
    "availableBytes": 8571795904
  },
  "notes": "LiveContainer guest with Dopamine's Allow JIT in Apps on; JIT came from Dopamine.",
  "os": {
    "build": "21A329",
    "name": "iPadOS",
    "version": "17.0"
  },
  "schemaVersion": 1
}
