{
  "app": {
    "build": "47",
    "bundleIdentifier": "com.getboolean.eikon",
    "commit": "ae51c38",
    "packageKind": "ipa",
    "version": "0.2.2"
  },
  "device": {
    "chip": "M2",
    "cpuFamily": "0xda33d83d",
    "modelIdentifier": "iPad14,5"
  },
  "gates": {},
  "generatedAt": "2026-09-28T09:48:50Z",
  "install": {
    "evidence": {
      "bundlePath": "/private/var/mobile/Containers/Data/Application/<uuid>/Documents/Applications/com.getboolean.eikon.app",
      "homeDirectory": "/var/mobile/Containers/Data/Application/<uuid>/Documents/Data/Application/<uuid>",
      "markers": [
        ".installed_dopamine"
      ]
    },
    "method": "unknown"
  },
  "jit": {
    "csDebugged": false,
    "csDebuggedSeen": "never",
    "probe": {
      "detail": "no CS_DEBUGGED",
      "kind": "notRun"
    },
    "reason": "unknownInstallNoJIT",
    "source": "none",
    "txm": {
      "basis": "os below 26",
      "enforced": false,
      "state": "absent"
    },
    "usable": false
  },
  "memory": {
    "availableBytes": 8570976768
  },
  "notes": "LiveContainer guest, normal launch. LiveContainer's own Launch with JIT needs JIT for LiveContainer itself, which it did not have.",
  "os": {
    "build": "21A329",
    "name": "iPadOS",
    "version": "17.0"
  },
  "schemaVersion": 1
}
